job_id,title,company_name,formatted_experience_level,description,noise_bucket
3322949022,"Director, Investment Sales",Kenai Capital Advisors,,"Job Title: Director, Investment SalesCompany: Kenai Capital AdvisorsLocation: Littleton, ColoradoJob Type: Full-time
About Us:Kenai Capital Advisors is a leader in the commercial real estate landscape, specializing in three core verticals that provide seamless expertise across the entire lifecycle of commercial assets. Our team strategically acquires institutional commercial real estate assets, manages those assets in-house with our expert property and asset managers, and our brokerage team provides sub-institutional capital market advisory services to clients nationally. 
As a trusted general partner and operator, our commitment to excellence is the cornerstone of our strategic approach in acquiring institutionally sized commercial real estate assets, primarily concentrated in the middle part of the United States. We excel in identifying investment opportunities that not only meet but surpass the expectations of our partners, resulting in superior risk-adjusted returns.
At the heart of our operations is our dedication to excellence in property management. Our seasoned team, with a track record of successfully managing over 20 million square feet of commercial assets, leverages a wealth of industry knowledge and cutting-edge technology to ensure the seamless operation and optimization of our real estate portfolio. From day-to-day operations to long-term strategic planning, we take pride in maintaining and enhancing the value of our assets.
Unlike no other institutional operator, Kenai Capital Advisors stands out with its distinguished commercial real estate brokerage arm. Our experienced team specializes in facilitating investment sales and equity raises, providing comprehensive advisory services to clients navigating the national commercial real estate market. With a unique perspective as both owners and operators of assets, our brokerage team carries an unparalleled understanding of property and market dynamics, coupled with an extensive network of industry connections. 
Whether you are an institutional investor seeking a strategic partner or a property owner in need of expert guidance, Kenai Capital Advisors is your trusted and results-driven ally in the dynamic world of commercial real estate. Our dedication to integrity, innovation, information, and client success positions us as an industry leader, making us the premier choice for comprehensive real estate solutions.
Kenai Capital Advisors is proud to be a veteran owned business. Job Summary:We are looking for a talented and results-driven person to join our team as a Commercial Real Estate Broker and take a pivotal role in managing and executing commercial real estate transactions. The ideal candidate will have a deep interest for commercial real estate, possess a good understanding of finance and the capital markets, be adept at negotiating complex sales transactions, have a lifelong passion for learning, and a knack for fostering strong relationships with clients and industry partners.
Responsibilities:1. Conduct in-depth market research to identify and evaluate commercial real estate investment opportunities.2. Build and nurture relationships with property owners, developers, and investors through phone calls, meetings, conferences, and other methods.3. Analyze financial data, market trends, and property values to advise clients on investment strategies.4. Prepare and present comprehensive proposals and investment analyses to clients.5. Lead negotiations for sales agreements.6. Collaborate with internal teams to ensure smooth and efficient transaction processes.7. Stay abreast of industry regulations, market dynamics, and emerging trends.8. Provide high-quality customer service, addressing client needs throughout the transaction lifecycle.
Qualifications:1. Bachelor’s or Master’s degree in Business, Finance, Real Estate, or related field.2. Deep desire to understand commercial real estate investment strategies and financial modeling. Financial modeling experience in Excel and/or Argus a plus. 3. Exceptional negotiation, communication, and interpersonal skills.4. Ability to work independently and collaboratively within a dynamic team environment.5. Detail-oriented with strong analytical and problem-solving abilities.6. Active real estate license must be obtained prior to acceptance. Benefits:- Competitive performance-based commission structure.- Comprehensive health, dental, and vision insurance.- Retirement savings plan.- Ability to invest alongside the Company’s real estate investments.- Professional development and training opportunities.
How to Apply:Interested candidates are invited to submit their resume and a tailored cover letter to info@kenaicap.com. Please include ""Investment Sales Broker Application"" in the subject line.
Kenai Capital Advisors is an equal opportunity employer, and we encourage candidates from diverse backgrounds to apply. 
",leadership_title_not_leadership
3486250934,Chief Executive Officer,ZM Jobs & Hiring Limited,,"We are looking for an experienced Chief Executive Officer or CEO to supervise and control all strategic and business aspects of the company. You will be the first in command in the company and responsible for giving the proper strategic direction as well as creating a vision for success.Chief Executive Officer Job Responsibilities:
Creates an environment and culture that focuses on fulfilling the company’s mission, vision, and values.Operational management of all business departments.Develops business prospects by studying economic trends and revenue opportunities; projecting acquisition and expansion prospects; analyzing organization operations; identifying opportunities for improvement, cost reduction, and systems enhancement; and accumulating capital to fund expansion.Ensures the company is staffed with well-trained, quality, and engaged employees at all times; works closely with the executive management team to develop effective hiring, training, and compensation plans to retain our quality talent; and leads and mentors staff, engaging and empowering them to be successful in serving customers.Oversees financial performance and risk profile while ensuring that all of regulatory obligations are met; manages the design and implementation of new products and services; and oversees brand development and the implementation of effective marketing strategies.Represents company at important business functions, community events, industry training and events, and networking opportunities.Ensures quality metrics are achieved through sound business processes following regulatory agency guidelines.Focuses on consensus building efforts and strategic planning.Ensures the timely submission of month-end financial and operational reviews, contributes to the development of and participation in corporate-wide strategic planning efforts.Monitors company performance by measuring and analyzing results, initiating corrective actions, and minimizing the impact of variances.Education, Experience, and Licensing Requirements
Bachelor’s or master’s degree in business, accounting, finance, or a related fieldMinimum of 10 years of management experience including extensive commercial lending/credit administration experienceIn-depth understanding of the industry including risk management, compliance, and regulatory requirementsIn-depth understanding of accounting principles including budgeting, balance sheets, income statements, cash flow, and capital planning managementStrategic leadership ability.",leadership_title_not_leadership
3511440340,Assistant Director,Kiddie Academies of Greater Seattle Careers,,"Assistant Director - Child Care CenterMake a difference in a child's life - and your own. Excellent opportunity for an early childhood Leader to grow.Kiddie Academy of Bellevue has an exciting leadership opportunity for an energetic, organized, experienced and inspiring professional to join us as Assistant Director. Apply now to join our leadership team at Kiddie Academy as the Assistant Director!We are a group (KAGS) of locally owned early childhood education academies in the Greater Seattle area. Our group owns and operates the Kiddie Academy locations in Bellevue, Bothell, Kirkland, Mill Creek, Kenmore and Seattle. We have an awesome work culture, and if you’re the right candidate, you’ll fit right in. We offer growth-oriented, challenging and rewarding career opportunities in a collaborative and supportive environment. We are committed, flexible and creative in our talent growth strategy.
Position Overview:As an Assistant Director you will assist and support Center Director in all aspects of management of the Academy, to include enrollment, human resources, marketing, customer relations, financial systems, quality control and physical facility. If you’re motivated by smiles and laughs from children and praise from parents, this could be the job for you.
We’re looking for:An enthusiastic leader with exceptional communication skills.Experience managing, growing enrollment and maintaining retention in a center-based program.Excellent administrative, organizational, verbal, listening, and communication skills.Action oriented, organized, strategic thinker, focused on getting the right things doneA thorough knowledge of WA Licensing regulations (WACs) for child care centers and a great understanding of developmentally-appropriate practicesAt least 2 years of early childhood education experience required as a center director.
We offer:Pay depending on position, experience and qualificationsExcellent Benefits which include, medical, dental and vision insurance with no lengthy wait periodPaid HolidaysPaid Time offGenerous child care discounts for employees (limited availability and conditions apply).Company paid professional development programFantastic growth opportunities available through job rotation, lateral move, and special project assignmentsBenefits vary based on full-time/part-time status... and much more. Visit our academy and learn more.About Kiddie Academy:Kiddie Academy® is a leader in educationally focused child cares for more than 30 years. Kiddie Academy redefined childcare by creating a place where fun and learning go hand in hand. KAGS Group is a franchisee of Kiddie Academy® and an equal opportunity employer.",leadership_title_not_leadership
3586242087,Director of Sales,,,"Company DescriptionExperts in international Oil and Gas Drilling, Hydraulic Fracturing, Production, Consulting, Engineering, Product Distribution, Operations, and Execution of Upstream Exploration & Production, Mid-Stream, Pipeline, all areas of Pressure Control Operations and Products. 
Role DescriptionThis is a full-time hybrid role as the Director of Sales at Diamond D Global. As the Director of Sales, you will be responsible for building, leading and managing the sales team, developing sales strategies, and driving revenue growth. You will also collaborate with cross-functional teams to develop and implement effective sales processes and initiatives. This role is located in Tampa, FL, with flexibility for remote work from other Florida locations.
QualificationsPrior experience in a leadership role within a sales organizationPrior Oil & Gas Experience preferably in pressure control Prior Industrial Bolting Experience a plus Prior Power & Water Experience a plus Well established book of business Knowledge of global supply chainBusiness development background a major plus Demonstrated track record of success in achieving and exceeding sales targetsStrong strategic thinking and problem-solving skillsExcellent communication and interpersonal skillsAbility to build and maintain relationships with key accounts Strong negotiation and closing skillsExperience with CRM software and sales analyticsBachelor's degree in business or a related field or equivalent work experienceAbility to travel as required
",leadership_title_not_leadership
23221523,Senior Elder Law / Trusts and Estates Associate Attorney,"Abrams Fensterman, LLP",,"Senior Associate Attorney - Elder Law / Trusts and Estates  Our legal team is committed to providing each client with quality counsel, innovative solutions, and personalized service. Founded in 2000, the firm offers the legal expertise of its 115+ attorneys, who have accumulated experience and problem-solving skills over decades of practice.
We are a prominent Lake Success Law Firm seeking an associate attorney for its growing Elder Law and Estate Planning practice. The successful candidate will be a self-motivated, detail-oriented team member with strong communication skills and a desire to grow their practice. Experience with Estate Planning, Administration, and Litigation and is preferred.
 Responsibilities will include:
Counseling clients with regard to estate planning and asset protection;Formulating and overseeing execution of Medicaid and estate plans;Drafting wills, revocable and irrevocable trusts, powers of attorney, health care proxies, and living wills;Estate Administration;Trust Administration;Court Appearances for Estate and Proceedings;Supervising paralegals 
Qualifications:Juris Doctor degree (J.D.) from an accredited law schoolLicensed to practice law in New York10-15 years of experienceExperience with various advance directives, trusts, and willsStrong analytical and problem-solving skillsAbility to build rapport with clientsExcellent written and verbal communication skills
 Competitive salary commensurate with experienceSalary: $140,000- $175,000Benefits: 401k, Medical, Dental, Life Insurance, PTO, and more
This position is based out of Lake Success, NY ",senior_title_not_seniorish
69333422,Senior Product Marketing Manager,Staffing Theory,,"A leading pharmaceutical company committed to developing and commercializing innovative and high-quality medicines that improve the lives of patients is now hiring for a Senior Product Marketing Manager. This role will be responsible for developing and executing marketing strategies for one or more pharmaceutical products. This individual will work closely with cross-functional teams including sales, medical affairs, market research, and commercial operations to develop and implement integrated marketing plans that drive product awareness, adoption, and revenue growth.
Responsibilities: Develop and implement integrated marketing plans for our pharmaceutical productsAct as the Marketing point on patient support initiatives including, patient HUB, patient advocacy groups, and bridge programLeverage insights and analysis of customer needs and market environment to inform marketing strategies and develop tactical plansWork closely with cross-functional teams to develop and execute product-specific promotional campaigns across multiple channels including digital, print, and events.Manage product-specific budgets and track performance against marketing objectives and KPIs. Participate in the development of product launch plans and ensure effective execution of launch activities. Collaborate with Training to identify training needs and develop and deliver sales force training materials to address these needs﻿Requirements: Minimum of 7 years of experience in pharmaceutical product marketing, with a demonstrated track record of success. Experience in immunology and preferably, in gastroenterology Strong knowledge of the pharmaceutical industry, including regulatory requirements, product development, and commercialization. Excellent communication and interpersonal skills, with the ability to collaborate effectively across cross-functional teams. Strong analytical skills and ability to analyze market research data to inform marketing strategies. Ability to manage budgets and track performance against marketing objectives. Ability to work independently and in a team environment.Willingness to travel up to 20% of is required.
",senior_title_not_seniorish
1183148438,"Montessori Lead Guide, Primary",,,"Montessori Primary (Early Childhood, 3-6) Lead Guide for 2024-2025 School YearFounded in 2006, Athena Montessori Academy is a private Montessori preschool in central Austin. We are seeking a Montessori trained, credentialed, and experienced Lead Guide for an established Primary 3-6 classroom to join our team of supportive Lead Primary guides. Ideal candidates have experience in Montessori, love working with young children, enjoy working on a collaborative team, and are open to learning and growing personally and professionally. We are a team that values healthy communication, is not afraid of courageous conversations, and practices giving and receiving feedback with each other. MACTE approved Montessori credential required.
Athena exists to build a healthy and courageous place to grow, play, and actualize an equitable community. We believe we have the opportunity to make the world a better place through the education of the young child, and prioritize diversity, equity, and inclusion in our decision making. We understand that we are preparing children for the world beyond school, and we are looking for teachers who represent different cultures, races, backgrounds, perspectives, identities, styles, and orientations. We are a school that not only aspires to meet the children's academic development, but also their social and emotional development, in our quest to truly follow the child.
Position starts summer of 2024 or August of 2024 (start date can be earlier for training and is flexible, but no later than August 5, 2024).
Pay: $45,000.00 - $77,000.00 per year, annual salary Hourly equivalent: $26.70 to $36.36/hr
Benefits:Health insurance paid 100%Discounts for vision, dental, and life insuranceTen paid personal/vacation/sick days (PTO), in addition to paid holidays and days when school is closedTwo weeks preparation paid prior to new school yearTwo hours of paid office hours dailySchool year schedule, following AISD calendar; summer camp optionalCompetitive SalaryExtensive team of support staff provide breaks and support during transitions, nap, and After SchoolSupportive and experienced administrative and leadership teamsProfessional development and ongoing training paid, including annual conference fees, travel, accommodations, and per diemLow ratiosSchool closures four days per school year for parent conferences; paid time out of the classroom to prepare for conferences
Application process:Review website at www.AthenaMontessoriAcademy.comRead the DEI/ABAR page of the website in its entiretySubmit cover letter, resume, and three professional references—supervisor, colleague, and parent


",senior_title_not_seniorish
2011147642,Lead Installer,BWE Home Theater,,"Position: Lead Installer with BWE Home Theater
Company Overview
Join our team at BWE Home Theater, a leading provider of home theater solutions committed to delivering exceptional audiovisual experiences to our clients. We specialize in designing, installing, and maintaining cutting-edge home entertainment systems, creating immersive environments that exceed expectations. We're seeking a talented Lead Installer to play a pivotal role in our mission to transform spaces into ultimate entertainment hubs.
Position Overview
We are currently seeking a skilled Lead Installer with a passion for technology and a keen eye for detail. The Lead Installer will be responsible for overseeing the installation process of home theater systems, ensuring quality workmanship, and providing top-notch customer service. This role requires strong technical expertise, leadership capabilities, and excellent communication skills to collaborate effectively with clients and team members.
Responsibilities
Lead and supervise installation teams to ensure projects are completed efficiently and to the highest standards.Perform site assessments and collaborate with clients to understand their requirements and preferences.Plan and organize installation schedules, resources, and materials to meet project deadlines.Install, configure, and calibrate audiovisual equipment, including speakers, projectors, screens, amplifiers, and control systems.Troubleshoot technical issues and provide solutions to optimize system performance.Conduct thorough quality checks to ensure installations meet company standards and client expectations.Provide comprehensive training to clients on system operation and functionality.Maintain accurate documentation of installation processes, equipment inventory, and project updates.Uphold safety protocols and compliance with industry regulations during all installations.
Qualifications
Minimum of 3 years of experience in audiovisual installation, preferably in a residential setting.Proven leadership skills with the ability to motivate and mentor installation teams.Strong technical proficiency in home theater equipment and systems integration.Excellent problem-solving abilities and attention to detail.Effective communication skills, both verbal and written, with the ability to interact professionally with clients and team members.Knowledge of electrical wiring, networking, and construction principles.Knowledge and experience with power tools, hand tools, ladders, etc.You will be expected to provide certain tools (examples: tool bag, hammer, basic hand tools, basic power tools, etc.) A comprehensive list of tools can be provided during the onboarding processAbility to work independently and adapt to changing project requirements.Valid driver's license and clean driving record.
Benefits
Competitive pay commensurate with experience.Benefits available, including health insurance and dental insurance (details will be discussed during the interview process)Opportunities for professional development and career advancement.Dynamic and collaborative work environment with a focus on innovation and creativity.Employee discounts on home theater products and services.
Join Our Team
If you are passionate about technology and delivering exceptional audiovisual experiences, we invite you to apply for the Lead Installer position at BWE Home Theater. Take the next step in your career and become part of our dedicated team committed to transforming homes into ultimate entertainment destinations. Apply now and embark on an exciting journey with us!",senior_title_not_seniorish
