job_id,title,company_name,formatted_experience_level,description,noise_bucket
2147609835,Trade Review Principal,The Job Network,,"Integrity is one of the nation’s leading independent distributors of life, health and wealth insurance products. With a strong insurtech focus, we embrace a broad and innovative approach to serving agents and clients alike. Integrity is driven by a singular purpose: to help people protect their health and wealth so they can be ready for the good days ahead.

Headquartered in Dallas, Texas, Integrity is committed to meeting Americans wherever they are — in person, over the phone or online. Integrity’s employees support hundreds of thousands of independent agents who serve the needs of millions of clients nationwide. For more information, visit IntegrityMarketing.com.

We are currently seeking an dedicated and driven Trade Review Principal to help lead Brokers Internal Financial Services, LLC registered representatives and investment advisory representatives.

Brokers International and our subsidiary organizations, Brokers Financial and Brokers International Mountain States work to empower financial professionals across the country with innovative solutions, support, technology, and marketing assistance so they can help more Americans effectively prepare for retirement. By joining our team, you’ll have the opportunity to work for one of the country’s largest and most experienced insurance marketing organizations, enabling you to positively impact thousands of financial professionals and their businesses.

What You'll Be Responsible For Provide Principal review and approval of transactions while working within firm’s established suitability guidelines and time frames.

Provide Principal review and approval on variety of business types: mutual funds, annuities, variable life insurance, financial planning advisory.Reviewing advisory accounts held through our clearing firms to ensure that the account opening process follows all company guidelines.Conduct customer account reviews to detect potential sales abuses.Maintain product knowledge.Handle incoming calls from RRs or clients to assist with various requests (i.e., withdrawals, address change, form requirements, firm procedures, etc.) and problem resolution.Provide education and training to representatives concerning regulatory, corporate, and legal requirements, general product offerings, licensing issues as well as internal processes & procedures.Notifying advisors when a transaction conflicts with a client’s investment profile, a company policy, or an industry regulation. Working with advisors to resolve escalated issues surrounding these investments.Work with the Compliance Department as needed to address regulatory concerns or improper sales practices.

Desired Qualifications: Four-year college or university program certificate; or two to four years related experience and/or training; or equivalent combination of education and experience.

FINRA Series 6, 26, and 65 required. Insurance and securities license(s) in state(s) of operation for life, health, and variable annuity may be required.Prior industry experience required.Advanced technical knowledge and advanced understanding of broker-dealer and RIA business processes. Thorough understanding of rules, regulations and legal requirements of the SEC, FINRA, MSRB, AML and state securities regulators. Product knowledge in variable life, variable annuities, mutual funds, managed accounts, financial planning, and securities.

Employee Benefits

Brokers International offers a comprehensive benefits package including PTO, paid holidays, medical, dental, retirement plan, Employee Ownership Program, employer paid short term disability, and more. We believe in a flexible work environment and have a hybrid work model for most positions. We also reward our employees’ hard work with profitability bonuses, a casual dress code, adjustable sit / stand desks, and free snacks, fruit and coffee. As an added bonus, we close every Friday at 3 p.m.

Our Culture

At Brokers International, our thriving, positive workplace culture helps drive our workforce and encourages overall employee wellbeing. We strive for an environment of inclusion while celebrating the individual creative differences embodied by all of our employees. If you want to be part of an innovative team dedicated to helping financial professionals build stronger businesses through tailored product sales, marketing, compliance and operational support, look no further.

About Integrity

Integrity is one of the nation’s leading independent distributors of life, health and wealth insurance products with a data and technology focus. We are an omnichannel insurtech company innovating insurance with a singular purpose: to help people protect their life, health and wealth so they can make the most of what life brings. Headquartered in Dallas, Texas, Integrity is committed to making insurance simpler and more human, so everyone can plan for the good days ahead. Integrity’s 5,500 employees currently support over 420,000 independent agents who serve the needs of more than 2.2 million clients annually. For more information, visit www.integritymarketing.com.

Integrity offers you the opportunity to start a career in a family-like environment that is rewarding and cutting edge. Why? Because we put our people first! At Integrity, you can start a new career path at company you’ll love, and we’ll love you back. We’re proud of the work we do and the culture we’ve built, where we celebrate your hard work and support you daily.

Joining us means being part of a hyper-growth company with tons of professional opportunities for you to accelerate your career. Integrity offers our people a competitive compensation package, including benefits that make work more fun and give you and your family peace of mind.

Integrity Marketing Group, LLC is an Equal Opportunity employer. All qualified applicants will receive consideration for employment without regard to race, color, religion, sex, gender identity, national origin, disability, veteran status, or any other characteristic protected by federal, state, or local law. In addition, Integrity Marketing Group, LLC will provide reasonable accommodations for qualified individuals with disabilities

PandoLogic. Keywords: Broker, Location: Urbandale, IA - 50322",senior_title_not_seniorish
2428973832,Staff Accountant,"Grow West MD, LLC",,"The ideal candidate will be responsible for timely and accurate preparation of financial accounting data in a variety of areas. It is essential that this candidate brings analytical and organizational skills in order to best support the accounting team.  Responsibilities· Posting of AP and AR invoices, ensuring accuracy of date, amount, and expense type.· Review, Approve, and Post Purchase Orders from the Dispensary.· Process Vendor Payments via check and ACH.· Record Journal Entries to allocate expenses of company credit card purchases.· Assist Controller in preparation of documents for month end close.· Complete Purchase Orders, Vendor Onboarding Documents, Credit Applications, and other business-related forms.· Prepare Bank Reconciliation Reports monthly.· Assist Controller and CFO in research and preparation of reports for Yearend Close and Yearly Financial Audits.· High level of communication, organizational and analytical skills.· Reinforce company policies with staff as needed. Constantly update job knowledge. Function in accordance with established standards, procedures, and applicable laws. Time management skills to meet processing and reporting deadlines.  Provide accounting and clerical assistance to the controller.· More Duties and Responsibilities may be added at the discretion of Management.
QualificationsBachelor's degree or equivalent in Accounting, Economics, or Finance0 - 2 years' experience in accountingProficient in Microsoft Excel",senior_title_not_seniorish
3377655935,Senior Account Manager,Garven Design Group,,"Are you a proactive, detail-oriented professional who is passionate about forging strong relationships with retail customers while driving sales growth? We are seeking a Senior Account Manager to join our team. This role is pivotal in managing and nurturing several key retail accounts, ensuring customer satisfaction, and achieving business objectives. Successful performance in the Senior Account Manager position may progress into Sales Lead role, where you will have increased responsibility driving initiatives on key accounts.
Key Responsibilities:Develop and maintain relationships with retail customers to understand their needs and influence outcomes.Collaborate with Sales to manage and execute details for national retail account programs, ensuring alignment with objectives and timelines.Comprehend business strategies and processes to meet customer requirements.Facilitate internal tasks and communication to ensure program objectives are met on time.Provide recommendations and work with cross-functional teams to optimize program management and development.Maintain accurate records and update internal process documents with a strong emphasis on detail.Conduct margin analysis and pricing reviews to align current programs with historical data and industry standards.Ensure customer needs are met while aligning with company goals and objectives.
Minimum Qualifications:Bachelor's degree or equivalent experience with 3+ years in account management for large retail accounts.Excellent written and verbal communication skills with a customer-focused perspective.Advanced skills in Microsoft Office Suite (Excel, Outlook, PowerPoint) and experience with retail customer web portals.Strong analytical skills with a background in Mass retail.Ability to analyze and resolve issues in an effective and timely manner.Strong organizational skills and attention to detail.Ability to prioritize and multitask in a fast-paced environment. Garven Design Group creates custom gifts and gift packaging for our retail partners. We offer a hybrid work environment and a comprehensive benefits package. This role offers an exciting opportunity to contribute to our growth and success in the retail sector while working within a collaborative and supportive team environment. This position is based out of our office in Edina, MN.",senior_title_not_seniorish
3475933396,Senior Developer,USLI,Associate,"This individual will work with a high performance team in the creation and maintenance of applications for our mobile, web and in-house systems. This individual will take on a work leadership role and has the interpersonal and technical skills required to guide a team. They displays poise and maturity in task completion and personal interactions and acknowledges their own responsibility and accountability. They utilize a deep understanding of Object Oriented principles in designing and developing solutions for new or existing systems. Understands, supports and provides guidance on the developer team fundamentals. This individual will communicate effectively with the business, other developers and with Information Technology leadership. They have excellent oral and written communication skills, customer service skills and the ability/flexibility to respond to and thrive in a fast-paced, ever-changing collaborative team environment. This individual has the ability to resolve team conflicts and determine resolutions to issues proactively. They will make deadlines and commitments and gain a moderate level of insurance knowledge of all products in the Company’s book of business. They will use individual development plan and is instrumental in helping others to become stronger developers. They have strong problem solving skills and the ability and desire to learn new technologies rapidly. They will enroll and complete continuing education programs in both Professional and Personal Development as outlined in annual Training and Development Plan. Developers are expected to mentor and support other team members and enable small team success.
Responsibilities and Qualifications:• Day to day oversight and direction on medium size team initiatives• Proficient knowledge of the .NET framework and understanding of the architecture and system design standards• Ultimately responsible for the management and taking advantage of code re-use• Able to extend a specific system by designing and implementing new feature sets with little architecture involvement• Responsible for the coding standards of the department and ensuring they are applied• Assists in recommending refactoring phases• Deep understanding of our complex systems and/or workflows• Keep up with new technologies and new developments in the software development field; collaborate with peers• Recognized expert in one or more of our technology disciplines.• Demonstrates innovative thinking to solve technology issues as well as the ability to solve complex problems• Consistently provides developer feedback to people leaders• Recognizes patterns in systems (Singleton, Factory) and is able to mentor others about USLI’s implementation of these patterns• Mentor and support other team members on complex technical subjects
At USLI, our goal is to strengthen our community and culture by representing all races, genders, religions and sexual orientations. We continue to move conversations about diversity, equity and inclusion forward to ensure every community member has a sense of belonging, a voice and a seat at the table USLI provides full-time community members with a comprehensive benefits package, access to wellness programs, continuing education resources, and multiple opportunities to get involved with charitable organizations. 
All positions are required to work on-site 75% of the time unless indicated otherwise in the job description. Candidates can discuss additional details with the hiring leader.College degree/technical certifications or equivalent industry/technical experience. Individual has a minimum of 10+ years of software development experience.
Specific Skills: ASP/ASP.NET, C#, MVC, Object Oriented Design/Development, VB/VB.NET, Agile/SCRUM, JavaScript/jQuery/jSON, Knockout.js, Angular.js, HTML 5, SQL Server, SQL/XML, Emerging Microsoft technologies. Working Hours: 9:00 a.m. – 5:00 p.m. Some overtime work as needed.",senior_title_not_seniorish
3533320307,Java architect / Lead Java developer,NLB Services,,"Position: Java architect / Lead Java developerLocation: New Jersey (Day one Onsite)Position Type: Full-Time
Skills Require: Java, Microservices, Rest Api, Web services, UI - React JS, Redux, Micro frontend, Typescript, React.js Job Description:· Strong Experience on Java Platform.· Hands on Java React and backend with architect exposure ( Lead or engineering manager) with offshore and onsite experience.
Please share your updated Resume at deepak.badhwar@nlbtech.com",senior_title_not_seniorish
3586167732,Senior Software Engineer,StyleAI,,"StyleAI is the AI-powered, all-in-one unified marketing platform for businesses and ambitious marketing teams. Thousands of companies rely on Style to manage their SEO strategies, Google Ads campaigns, and websites in real time. Based in San Francisco, StyleAI offers three turnkey products: Seona, Crafta, and Adwin, helping businesses automate their entire digital marketing strategy. We are looking to rapidly scale and hire exceptional technical talent. Some information about us:Strategic investors: Raised over $6M from a great investing team including HOF Capital, Avenir, General Catalyst, etc. We are also partnered with the SEO industry leader Semrush and data analytics platform SimilarWeb.Exceptional product market fit: We have seen rapid growth since our inception, going from $0→3M ARR in the last 12 months.Strong talent density: Our team was founded by 2 Berkeley dropouts and consists of high-impact, team players with exceptional technical skills. Our team has turned down offers from Airbnb, Microsoft, Pinterest, IMC Trading, CrowdStrike, Shopify, Palantir, and Cisco to pursue our own vision instead.
Our mission is to democratize digital marketing for all businesses. With StyleAI, it's easier than ever for small businesses to establish a strong online presence.
About the RoleAs an early member of the engineering team at StyleAI, you will own and lead engineering projects that define the user experience of our various product lines. You’ll be responsible for much of the development of our core product offerings: Crafta, Seona, or Adwin.We are a cross-functional team with a culture of collaboration and ownership - we highly encourage developers to resonate with customers, provide infrastructure input, and take-part in strategic product discussions. If any of this resonates with you, this role might be right for you.This role is based in San Francisco, CA. We are full in-person and offer relocation assistance to prospective employees.
ResponsibilitiesBuild intuitive, user-first web apps that can scale with our user base.Work collaboratively with the rest of the engineering team to deliver infrastructure for core and emerging productsSolve complex technical problems, either independently or collaboratively, to deliver innovative solutions that provide customer value and directly impact key business metrics.Understanding and willingness to maintain our core infrastructure.Ensure all code being pushed to the production (across the team) is excellent.
Qualifications8+ years of experience in software development and extremely strong track record, launching innovative products from 0→1 and at scaleStartup mindset - Scrappy, intelligent, and entrepreneurially minded individuals interested in joining a fast paced startup and looking for early ownership and growth.Tech stack experience - Our tech stack includes Typescript/Javascript on the frontend, Golang in the backend, a job queuing system with Kafka, PostgreSQL as our database and cloud hosting with GCP. Experience with Golang and GCP is a bonus.Strong knowledge of SMB and consumer tools - experience with world-class teams in this space is a plus.Track record of shipping and scaling SaaS products, strong attention to detail.
CompensationThe expected range of compensation for this role is $200,000+. Additionally, this role will participate in our equity plan. This salary range may be inclusive of several career levels at StyleAI and will be narrowed during the interview process based on a number of factors such as scope and responsibilities, the candidate’s experience and qualifications, and onboarding.
Useful links:Website: https://usestyle.ai/We practice our tenets religiously: https://usestyle.ai/tenetsLearn more about our company culture here: https://usestyleai.notion.site/StyleAI-Mission-Vision-Tenets-e948703d845043b49bc1dc3015d00c6e",senior_title_not_seniorish
